评分,评论内容
5,不错 不错 快递小哥很给力 必须大赞一个👍 👍 必须大赞一个👍👍 但是包装过于简陋 运送中很容易引起磕碰挤压破损 至于商品性能 等用过后再来追评
5,手机已经收到了 整个使用效果挺好
5,买HUAWEI Pura 70 Pro+ 弦乐白 全网通 卫星移动终端，昨天2025.4.1下单，今中午收到，包裹件外包装盒和机子塑封盒包装完好。京东自营质量顶呱呱！包裹件运输和快递小哥送件神速，赞！👍五星好评！👍👏💐😊
5,商品符合描述，主要是活动便宜，能省很多钱质量很好哦，发货也很快，一家非常喜欢的店铺，我要疯狂推荐给朋友们
5,pro+的最大亮点就是贝壳的这个纹理特色，拿在手上的手感真的非常好，16+512的存储量打游戏喝日常使用也是毫无压力
5,给妈妈买的，妈妈很喜欢，说超级漂亮。实物很赞妈妈一直用华为的，手机很耐用，一款手机可以用好多年。速度一直很快。手感很好大小合适。
5,很好很棒很不错物超所值特别喜欢下次还会再来光顾的很好很喜欢特别棒，😁😁😁😁😁😁😁😁😁😁😁😁
5,"拍照功能遥遥领先。
问：一座桥承重80kg，有一头牛100kg，要如何过桥？答：买一部华为手机过桥，因为华为手机就是牛！"
5,华为mate70pro+非常不错，很流畅，价格很合适，京东购买的快递非常的快，用起来非常的不错，以后还会来购买的
5,物流很快，👍产品很快就收到了，比想象中还好，不错不错！希望能耐用
5,整体来说手机使用起来很方便，价格也很划算，性能流畅，价格实惠，是旗舰店购买的也比较放心有保障。
5,昨天下单的今天就到了 京东自营速度真快啊 这款现在性价比太高了 入手的好时机 以前还溢价 根本买不到
5,不卡，真的不卡！拍照很好看，清晰度高！！！白色小清新！手感很好！！电池也可以！！国补够优惠
5,华为p70pro+非常好看，价格合适，京东购入的有保障，快递非常快外观非常好看，以后还会来购买的
5,华为P70 Pro+亮点突出，影像、性能、续航等表现都很优秀，虽有小瑕疵，但不影响它成为一款值得入手的旗舰手机 。
5,物流非常快，隔天就到！包装不好，没破损。外观很漂亮，手感不错，系统流程无卡顿，家人很喜欢！！
5,像素不错，客服态度很好像素很高，但是运行速度很快，比我想象中的要好很多
5,新年用新机，京东活动补贴力度大，到手价格很香，配送速度很快，包装完好，正品保障！放心购买！
5,这款手机太棒啦!外观时尚，性能强劲，拍照清晰，运行流畅，用起来超顺手，爱了!不错不错哦
5,手机外观时尚，充电头给力，我非常喜爱，且还有12期免息分期，非常棒。
5,宝贝收到咯👌🏻，真的很棒呀！🌈质量真是没话说，非常满意！🆗开心开心😃。
5,这手机用着可太棒啦！拍照效果杠杠的，不管是风景还是人物，拍出来都特别清晰好看，色彩也特别真实。运行速度超快，一点都不卡顿，不管是玩游戏还是多任务处理，都轻松应对。屏幕显示效果也超赞，看着特别舒服。而且续航能力也不错，能用挺长时间，一天下来基本不用愁没电，用着特别顺手，我可太满意了。
5,手感非常好，很丝滑，颜色好看，拍照非常好看，不愧是华为，支持国产！
5,可以的 华为大品牌 物超所值 体验刚满分 推荐给大家 不会失望的
5,发货很及时，价格便宜满意满意满意满意满意满意满意满意满意满意满意满意满意满意满意满意满意
5,充电发热，拍照效果不错。轻薄手感很好。
5,是理想中的产品，质量不错，物流也很快，值得点赞
5,手机不错，快递很快，快买
5,非常满意😘，材质做工非常好，而且百搭，手感也很棒，非常nice，实用性非常强，赞👍不得不说，这商品太值了，物美价廉，质量出色。物流快，商家服务周到，售后有保障。
5,"真的好看，我家小孩都喜欢
值得购买，就是有点贵"
5,这款手机真的很不错！🎈物流也很快，包装完好无损，服务很贴心。使用后感觉效果很好，质量杠杠的，满足了我的所有期待😊！会继续关注这个品牌的商品！🌟
5,首次购买华为P系列手机，性能杠杠的
5,手机很好，非常喜欢，性价比很高
5,手机是原装全新的。用的很好用。服务好，速度快。
5,包装完好，等用一段时间后再追评
5,用了一周多一点时间了，感觉手感很好，当时实在抢不到mate 70 PRO+，等不及了，看到pura系列降价，对比了一下觉得这款最好就买了，挺好用的。
5,时尚大气，美观，系统流畅，品质一如既往的好。
5,性价比高值得推荐，性价比高值得推荐，性价比高值得推荐，性价比高值得推荐，性价比高值得推荐，性价比高值得推荐，性价比高值得推荐，性价比高值得推荐，
5,这部手机3.8刚下单还没过7天掉了两次价格差价5.6百，京东保价补了2百，手机到是挺好，就是这价格不稳定
5,外形外观：好屏幕音效：好拍照效果：好运行速度：好待机时间：块其他特色：贼#的手机以旧换新：还行还行还行还行
5,非常流畅，有质感
5,手机收到了，实物比图片更漂亮。卖家很负责，详细介绍了手机的各种功能和使用方法。发货速度快，物流也很给力。非常满意！
5,外观和质量都很满意，物流速度快，商家服务专业，性价比高，推荐购买。
5,"华为Pura 70 Pro+外观设计简约大气，边缘圆润，手感舒适,手机的摄像头质量极高，拍照效果清晰自然,系统运行流畅,就是京东刚买就降价了，果断退了上一个重新下单，这次还送了一个流量卡，不错。还有就是华为现在不显示几G信号了，挺不适应的。"
5,机器手感很好，屏幕也比较大，看着很舒服，拍照效果也很好，白色的外观大气简单耐看
5,宝贝，早就到了，用了些时间感觉，真心的不错，比之前的手机快了好多，还有外观，我感觉好时尚，今天下的单，第二天就到了，速度也快
5,物流很快，物品完好无损，做工不错，2月买的，机子是去年12月的，总体不错。
5,质量非常好，与卖家描述的完全一致，真的很喜欢，完全超出期望值。发货速度极快，包装仔细又严实。京东物流服务佳、运送快。客服态度超棒，有问必答。这是一次超满意的购物，会再次光顾，也会推荐给朋友
5,很喜欢pro的外观，选择她我纠结了很久，最后挑来挑去还是选了我最中意的
5,手感很好，外观设计感很强！白色的很喜欢，用起来运行流畅，性能杠杠的！！！
5,这次购物体验完美！商品性价比高，质量出色。物流高效，商家服务贴心，售后让人安心。
5,物流很快，手机颜值俱佳，运行很流畅，拍照效果也很好！
5,华为拍照手机天花板，超级高清的摄像头和图片处理器，为国货点赞
5,挺不错的，外观好看，感觉这大小对女生来说非常合适
5,手机很不错，很好用，价格也不贵，值得购买。手机很不错
5,"宝贝收到了，卖家发货很快，物流也非常给力,客服服务态度极好，很有耐心、给人一种亲切感，好喜欢。还有包装精美，高端大气上档次；看得出来商家很用心。 可以可以可以可以"
5,这款手机使用非常的丝滑不卡顿。
5,整体不错的，很高大上的感觉，用起来应该很棒的，非常喜欢
5,东西不错，还有优惠，可以放心省钱购买，不要犹豫了这个价格能买到这种质量的产品，简直是捡到宝了，惊喜万分！商品物超所值，质量没毛病。物流迅速，商家服务热情，售后服务周到。
5,华为手机挺好的，性能好，流畅，满意！
5,外形外观：入手一段时间了，体验感很棒 拍照很出色
5,运行流畅，待机时间长，拍照清晰，很是喜欢
5,外观设计风格非常独特，好看发货速度也很快
5,婆婆婆OPPO婆婆婆婆婆婆婆婆
5,一般，前置摄像头很糊，~视频糊，自拍糊，镜子也糊，后置还不错，屏幕是冷色，偶尔打开APP#机，其实就是p60pro，感觉都不如p60pro，就多了个麒麟芯片
5,不用苹果了，支持国货
5,新手机真好用，原来很早用的是p30，现在也算传承下来了。
5,商品质量好价格也划算
5,入手有段时间了，必须来夸夸。外观颜色很特别，拿在手上辨识度超高。拍照效果特别好，拍风景细节满满，晚上拍夜景也很清晰。处理器很给力，日常使用一点不卡顿，我真的越用越喜欢 。
5,买了白色，经典色值得购买，就是有点小贵
5,非常好用，不愧是华为
5,好好好好好好好好好好好好好好
5,这款手机非常好！拍照效果非常不错！
5,很好，喜欢，华为的产品没得说，我的上一款华为手机用了7年，还很好用，中间换了一次电池，现在想换一款拍照更好的手机，毫不犹豫的再选华为
5,外形外观：很漂亮、送媳妇！很喜欢！
5,非常好非常好非常好
5,给妈咪买的 她还蛮喜欢的 不错不错
5,第一次买这么贵的手机，很好用的
5,好用好好好啊好喝好好
5,质量很好，使用起来感觉非常好。
5,一直等活动，等不来，颜值在线
5,此用户未及时填写评价内容，系统默认评价！
5,还不错，国产越来越好了
5,同事推荐的，我们是听障人士，买之前试了下声音大小，音量很大，还有拍视频防抖，这点很好，唯一不足的就是手机自带屏幕保护膜不好，才用几天就花了
5,手机很好，拍照很好看
5,买来送人，收到后很喜欢
5,好用推荐给你感谢卖家
5,"送给弟弟的，外观非常好看，弟弟也喜欢，搞得我也想换一个。支持国货。非常满意，喜欢。
屏幕音效：声音特别大。
拍照效果：自动美颜效果。"
5,作为一个极其挑剔的购物者，这次真的被惊艳到了。商品的功能很实用，配货速度奇快。服务质量更是卓越非凡，热情周到，让人折服！
5,非常不错，下次还会再来的
5,此用户未填写评价内容
5,本次电商购物安全下车。首先商家的服务态度无可指摘，包装精美别致，让人喜欢。商品功能和宣传一致，绝对的物超所值！
5,不太爱评价，但这个是真的棒！质量很好，做工细致，包裹很严实，快递服务态度好，绝对好评！
5,手机不错，电池续航也可以，服务态度很好！总之一句话，支持国货。充电快，手机也不卡，好评
5,到货快，包装完好，使用了一段时间，非常好用，非常满意下次还会继续购买该产品。
5,"遥遥领先，华为手机
外形外观：设计新颖
屏幕音效：质量好
拍照效果：高清"
5,"外形外观：好看
拍照效果：清楚
待机时间：长
运行速度：快
屏幕音效：好"
5,商品质量无可挑剔，价格亲民，真是物超所值。物流顺畅，商家服务贴心，售后有保障，太棒了！
5,发的京东物流！中通快递（京东快递号)提示已放自提点!物流信息提示物业已签收！这是什么鬼操作！
5,🛒发货速度非常快！服务也非常热情，有问必答，质量非常好，与卖家描述的完全一致，非常满意！
5,物流很快，第一天购买，第二天就到家了。外观非常美观，使用起来虽然不如苹果顺畅。
5,"果粉转华为了，相信华为的质量。逐渐熟悉鸿蒙系统中。
京东的速度没得说！"
5,"手机收到了外观漂亮运行流畅照相效果很好，
屏幕音效：屏幕分辨率很高
音质效果非常好"
5,强烈推荐！商品物超所值，质量可靠。物流快，商家服务热情，售后服务完善。
5,宝贝收到了，很惊喜，质量非常好，很满意的一次购物。我会继续回购的，店家值得信赖
5,全家都是用的华为系统，值得信赖的牌子，拍照效果好，外形好看，尺寸合适
5,商品物超所值，质量没毛病。物流迅速，商家服务热情，售后服务周到。
5,商品收到咯，特别喜欢，一收到就迫不及待地打开了，家人也很满意，这次购物体验不错
5,"外形外观：精美
屏幕音效：声音唯美

拍照效果：拍照清晰
运行速度：上网速度快"
5,"使用一段时间啦，很好
外形外观：外形又好看
屏幕音效：屏幕丝滑，音效好"
5,"拍照很好，
外形外观：很有个性，
待机时间：续航时间久用一天没问题"
5,宝贝收到，一如既往的好，包装很到位，质量还不错，很喜欢，大品牌值得信赖
5,非常满意的一次购物，产品外观和质量都很棒，物流速度快，商家服务专业。
5,给家人买的，颜色很好看性能对长辈来说完全够，手感也很好，不错不错
5,"运行速度：快，
外形外观：喜欢，
其他特色：期待鸿蒙，支持鸿蒙"
5,购物体验很棒，商品物美价廉，质量优秀。物流迅速，商家服务贴心，售后无忧。
5,质量口碑好，值得购买，值得推荐，值得信赖，值得拥有
5,商品物美价廉，质量让人惊喜。物流很棒，商家服务贴心，售后处理也让人满意。
5,非常不错，这个时间段价格也划算，自己升级了纯血鸿蒙，好用，主要是心里踏实
5,质量不错，相机非常好，老婆很喜欢。。。。
5,好不容易才抢到了比较优惠的价格，这是买来送朋友的，她非常非常的喜欢
5,手机性能相当棒 最信赖的就是京东了 京东上买的东西放心 华为手机 遥遥领先！太好了
5,物流很快，早上买下午就收到了，包装完好
5,值得信赖的品牌！p系列拍照效果确实不错，已经准备期待演唱会了
5,"买完就国补了。。。
不过手机是真不错，拍照无敌"
5,非常好，拍照图片太清晰了，这个非常赞
5,从苹果换成了华为，还在适应中，整体感觉不错。
5,一代神机，遥遥领先，手感确实不错，给长辈买的，很满意很给力
5,发热比较严重。其他还可以，第一次买这个牌子，先用用看吧。
5,特别特别特别好，没有任何破损的地方，外观也好看，好评！
5,给老婆买的，她一直都很喜欢华为。希望鸿蒙和华为越来越好💪
5,这款产品质量超乎想象，卖家服务态度非常好，发货速度快，非常满意！
5,华为永远值得信赖，多次购买从未失望
5,好 很好，就是有点发热 系统流畅
5,价格实惠，质量杠杠的，非常好的一次购物，下次还来
5,华为手机性能很好，颜值很高，拍照好看
5,大小合适，设计有特点，苹果用久了，换华为试试看
5,拍照很可以，电池很耐用，很好用的手机。
5,还可以~用起来**惯的~就是拍照还是差了点~
5,华为大品牌值得信赖国产手机首选机型
5,出乎意料的好，商家细心讲解，优惠多多
5,就是价格浮动过大，七天降了500
5,京东客服服务很好👍有任何问题及时给解决了
5,手机自带保护外壳，为啥下方还推荐购买
5,好，真的好用，国货之光啊
5,用起来很不错，适应中。
5,手机使用一段时间体验非常好。。
5,华为很不错，拍照很好。
5,华为出品必属精品，买不到mate70pro+，所以买了这个，还不错
5,用着特别流畅，发货很快，手机颜值很高
5,一直没有来评价，这个手感贼好，这个感觉比60好太多了吧
5,手机首先颜值在线，功能很厉害，价格又有优惠，简直就是梦中情机。
5,外观很好，直板机，使用无卡顿，卫星机。
5,发货很快，包装细致，正品
5,手感好，待机时间长，照相清晰，音频效果好。
5,有国补真好，给力！
5,网络切换不好，触摸屏不好用，目前就这些
5,国补买的，华为很不错
5,购买2天，降价300元，京东平台不给保价
5,手机非常不错，很好用，很喜欢
5,OK看看可口可乐了了可口可乐咯考虑
5,东西不错，价格也比较合理。
5,很好，一直买的都是华为的，很不错。
5,手机收到了，试了一下感觉还不错点赞👍👍
5,"外形外观：很好看
运行速度：速度速度快
待机时间：很久"
5,"外形外观：漂亮
屏幕音效：很清晰"
5,挺好的，正好有优惠买个当备用机器
5,手机很好，配置很给力，颜值也在线
5,很快很方便，手机也有保证
5,很好看，老婆很喜欢，这样就可以了
5,非常好用的一款手机  值得推荐大家入手
5,很好很不错 知得推荐的一件
5,发货很快质量很好一直支持
5,手机很漂亮，使用效果过几天再评价，其它服务好。
5,喜欢很久了终于入手了，感觉非常不错，很满意，
5,发货快，价格实惠。不错
5,可以还是不错的可以。
5,东西真的很不错的，用起来顺滑，值得购买的
5,入手很好，和介绍一样，物流很快
5,此用户未填写评价内容
5,外观好看，手感圆润细腻，系统很流畅，
5,降价太快   说的保价  又说过不支持
5,拍照不错，支持华为，
5,非常好，不错 牛哥说的  很湿滑
5,物流很快 手感也不错
5,用着不错，手感很好，像素也很棒
5,用了一段时间，怎么有时候会卡，
5,爱华为就行了
5,非常666666
5,手机原装，特别好
4,经常在京东上买东西，物流方面真不错
5,好用，手感不错
4,宝贝收到了，很惊喜，质量非常好，很满意的一次购物。我会继续回购的，店家值得信赖
5,用起来挺好的
4,很好，物流很快，东西很给力，性价比很高！正品，棒棒哒，价格很优惠，总而言之挺好的，还会再买非常喜欢
5,很漂亮，好看
5,挺好的，喜欢
5,用起来还不错
4,还没习惯用的很多功能，以后慢慢磨合吧
4,这个手机还行，挺不错的，就是续航短点
5,手感很好
5,有点发热
5,手机不错
5,很不错。
5,非常不错
5,手机很好
5,特别好
5,非常好
5,速度快
5,流畅
5,靓货
5,可以
5,好用
5,快
3,拍视屏像素很差，拍照还行，这个手机真是容易发烫，mate30pro换的这个手机，体验感不是很好，手机导航感觉更新比较慢，有点卡🙃用了4年多的mate30pro都没这个情况，有点小失望！
3,出现闪屏
3,"外形外观：外观很漂亮，选了炫乐白，喜欢的一款
拍照效果：拍照效果没得说，非常棒。清晰度特别高。色彩明快有层次。
运行速度：没有对比，说不清楚。

待机时间：怀疑我的手机有问题，特别容易发烫，太阳下用不到一分钟就很烫了，有的小程序用不了多少时间就发烫，待机时间远远低于预期，就算充满电也用不了一天。"
3,"上次用华为还是华为mate9, 后面被制裁后就转向了荣耀magic系列，现在华为回归了，又转回来。这手机比我之前使用的荣耀magic6pro手感好多了，现在手机用多了还是觉得直屏好。遗憾的是p系列没有3D人脸解锁，都7、8000的手机壳，我觉得可以配一个。处理器的话，性能确实赶不上骁龙，综合性能差不多落后骁龙8gen3两代，不过我不打游戏，所以无所谓，不过让我担忧的是续航和发热。夏天快到了，这手机在使用时发热还是存在的，特别是在充电和更新下载应用时，续航也一般，我有续航焦虑，所以比较担忧这个。拍照的话，属于一般水平吧，没有p40那代技压群雄的实力了。综合下来感觉是及格水平吧，希望华为再接再厉，做出更好的手机"
3,这个华为手机刚开始表现不错，但升级后鸿蒙系统让我难以评价。我玩和平精英时，它不给我正常游戏，反而给我下了一个体验服。虽然我能体验到别人没有的服务，但最近让我苦恼的是，~和和平精英不断更新，导致账号始终无法登录。因此，建议大家理性思考后再购买这款华为手机。
3,刚刚收到货，还没开始拆包装，就发现外包装盒有明显的擦痕。
3,"这个真的太🉑了，🎁包装很精美，宝贝做工比较精细，商家特别好❤，有问题都及时处理👍，确实是一次相当满意的网购，还会再来的😘发货很快，已经收到货了，商品和描述的差不多，质量没问题，关键价格也合适，在这里买还是很放心的，好评！
感觉拍照也就那样，价格贵了，名不副实"
3,用了好几部苹果，唯一一次买国产机，还是顶端机，像素差，刷视频卡。还需努力，赶不上别人啊。
2,"这次整体购物体验不太好，11.1下单，选的是以旧换新。新机是成都发的，选的两次上门，回收旧手机的师傅4号就到了，新机6号才收到。有点好奇，这个价位手机也不算便宜，是货运到拉萨，而不是空运，路途上需要耽误这么久的时间。
回收的平台是爱回收，咨询客服，回答也不是很专业，我把单号发给他，先是答复过了保价期，后面质疑他保价期不是11.1-11.11日么，才回复说可以邮寄到他们那儿。问邮寄地址，等了半天还没回复。我直接打问号才慢悠悠的回复了邮寄地址，在成都。好奇网上搜了一下，拉萨不是有爱回收么，不懂为什么要寄成都。。离我住的小区也就几公里"
2,手机性能没什么问题，但是外观上包装被压坏了，不知道什么原因，找客服客服说过了七天也不让换，自认倒霉吧，因为出差没有第一时间拆封查看，不然就退了！
2,先说问题：手机发热非常严重，正常聊~刷刷知乎虎扑都会非常热，网上也看了很多技巧，都照做了还是发热严重，更离谱的是充电的时候聊~刷知乎反而不热，不知道是系统问题还是芯片问题。另外就是扬声器和手机听筒有一种难受的杂音，接打电话的时候特别明显，但是去售后检测了说没问题，由他去吧。好的方面：屏幕素质很不错，比mate60pro屏幕跟太多，握持感很好，拍照有升级。综合：信仰溢价大概有3000吧，整体使用下来一般一般，其他平台降了大概1500左右吧，图京东售后省事买的，但现在京东售后一团糟，如果想体验鸿蒙，哪里便宜哪里买。
3,1.~/QQ在深色模式下花屏2.播放视频时旋~机机身后播放音量差异明显3.价格跳动并不在7天价保内到手5天就降价2004.人工客服机械式解决问题线下售后检测无实质作用
3,外观挺好看，手感也行，就是有点重。说实话电量一般般，手机也容易发热。信号是比苹果强，但是拍照能力却不太行。总体来说这个手机给我感觉就一般般
3,"这款手机极易发烫,拍几张照片手机烫得拿不住。

看几篇文章，手机都有可能发烫。以8000元的价格买这样的手机，我认为性价比不高。
我的上一款手机是p50，整体评价也是性价比不高。那款手机的问题是经常容易黑屏，时常出现卡顿现象。



如果上天再给我一次选择的机会，我会选择其他的国产手机品牌。"
3,贵就算了，还烂，鸟样
3,京东物流物流一直很快，商家服务都很好，只是商品本身有很多诟病，使用了几天，每天都是在拍摄大量的照片，以拍照为主打的旗舰手机，拍照一言难尽，一倍焦拍摄几十米以外的矩形物体，90%都有物体变形的现象，很闹心！电池和发热的问题还好，没有网上说的那么夸张
3,手机真的一般吧，咋咋呼呼这么厉害其实很一般。再就是看爱国情怀把价格定那么高不是长久之计！，手机真的一般吧，咋咋呼呼这么厉害其实很一般。再就是看爱国情怀把价格定那么高不是长久之计！手机真的一般吧，咋咋呼呼这么厉害其实很一般。再就是看爱国情怀把价格定那么高不是长久之计！
3,"真心不如我的mate30pro,电池不耐用，没想象中的完美，当时买回来就想退了呢，客户也是为了照顾我说给我送个礼品，我说能不能送个蓝牙耳机，因为手机不带耳机，最后送我一个自拍杆，唉，但是我的手机是以旧换新，退的话很不划算，凑合用吧。"
3,大小合适，做工精良，出口品质，最满意的一次淘货，很喜欢，下次会再来！
3,贴个膜还是被刮花的，无语😑😑还有一点，手机声音开一半会觉得屏幕特别震动，
3,怎么说呢，一直购买华为产品是有支持国产的情结在的，将来不出意外的话也会继续。但是确实使用就会发热，屏幕发烫，续航力差强人意，而且很重，对我有腱鞘炎的人来说不太友好，希望华为继续优化自己的产品，遥遥领先不是靠说的。
2,手机是好手机  就是有瑕疵，有缝隙 ，不超过 0.2 毫米不算问题机   ，有点后悔从苹果转为华为了
2,建议把手机顶部显示栏合并在一起，为什么要分开来？你知道这个设计有多退化吗，每次都要多点一下，关键是玩游戏的时候，都要多划几下
3,"外观看起来比较高级，系统流畅，外放音质比较差，耗电比较快，基本要一天一充，有些软件适配没弄好，有bag,有点容易发热，价格偏贵 ，还有饥饿营销&hellip;"
