评分,评论内容
2,"当天10点20左右抢到的，下午三点半就收到了，快递这方面没的说，生怕我退货
还行吧，刚开始想买紫色Pro版本的，实在是抢了三天抢不到，只能换Pro+，买了这Pro+早知道加多一千买伸缩摄像头的了😓😓  气人的饥渴营销，好好的卖手机不好吗？非得要抢"
3,包装差，换货一次
2,手机收到了    但是，感觉自己收到的是二手手机  手机总容量和实际能用的容量不一样      有些软件都是下载好的                  问了客服     也没给我专业的解释        我还是怀疑
3,此用户未填写评价内容
3,发烫很严重，比小米还烫🤗续航一天两充，会卡卡的，打~电话有时候点不回页面，半个月降价一千，很夸张😅前置摄像头很糊有点黄，后置还可以
3,这个手机到底免息不免息写的免息后面还要扣300多的服务费，问客服就给我发点这个，你们的都免息不
3,标准版@精尊保护套装有什么区别 价差咋差这么多 不解
3,这款手机值得拥有，体验感不错
3,昆仑玻璃也得贴膜 一天没贴膜全是划痕
3,6.18买的，7.18降价800，真牛鼻。卡着价保的时间降，无语了
3,有点后悔买了，发热太严重了，烫手😓😓😓，没想象中那么好，哎
2,商品收到发现掉漆，虽说客服说可以换，但换机流程也要3-7天，本来都是想尽快拿到手机使用，结果闹这出，太影响感知了。
2,一个月内出现两次售后，还有这个像素，是不允许给好评的。
3,我觉得使用下来，电池不太耐用，挺耗电的。
3,手机看着还行，就是价格有点高。
2,不建议需要夜间相机的买。灯光好的情况下拍得挺好。晚上很模糊。微距我也觉得不好用。刷~有点卡，好像带不动了一样。
3,~发图片要几分钟拉几
2,华为前置调教得极差，没有光的地方非常糊，比我的苹果xr还糊，8000块钱的手机调教成这样非常不应该，通过算法出来的成像失了本来的面目，就拍照而严，在光线不足的情况下，不管是前置还是后置都极其不尽如人意，作为一个华为粉，非常失望
2,"后悔，因为手机坏了着急，就买了这个。早知道还是多加点钱买 Pura 70 Ultra，找客服加钱也不能换了。可惜。还是伸缩摄像头比较酷。
这个就很一般。感觉没什么特别，还那么贵。"
2,刚拿到手机两天  拍照效果确实可以    但是充电的时候会发烫不知道其他的有没有这种体验   续航能力也没有想象的那么好，还有就是互动主题中的趣味场景动不了。准备在观察一天看看   如果还是这样的话  就考虑退换货了。
2,根本就装进不进
3,此用户未填写评价内容
2,充电发热，电池续航一般
2,刚买七天就降价了，隔了两天申请保价就不行了，手机也一般，没必要非得买华为，确实没啥性价比。
3,这包装 &hellip;我以后还敢在你这买吗？
2,"手机发热很厉害，电池消耗很快。
拍照色彩很差，不真实。
很后悔买了。"
2,辣鸡，有问题不够退货
2,不值这个价，拍照一般，刷视频非常模糊，支持国产，但是得对得起人民群众，这个价格太贵
2,30天价保一完，到手不到2个月，降价800。甚至某夕夕百亿补贴相当于降价1800
2,超级发烫，掉电厉害，8000块买了个啥工业垃圾。
2,手机看着还可以  就是还没到一个月就降价了  亏了
2,用到现在才发现有贴膜，是不是二手的？？？
3,听筒有杂质
2,手机容易发烫
1,拍照不放大倍数就正常，一放大倍数就有异响，到货的时候只试了拍照，没有试放大，几天前才发现，看了一下已经过了保修期了。我看~才知道，原来很多机子都出现了这个问题。。。。。大家收到货试一下吧！谨慎下单！！！
1,此用户未及时填写评价内容
1,此用户未及时填写评价内容
1,产品质量超级差，双十一买用到现在20天就卡了好几次，售后不给处理，不给换货
1,#果然名不虚传，你告诉我这个不是别人换货的机器
1,真是太让我失望了，从19年开始在京东上买手机，到现在刚买几天的一个华为pura 70pro ➕，买的华为后置摄像头发过来就有灰，开机三天发现的，让我拿去华为售后服务检测，我当时就去了，一开始实体店售后说可以更换新机，后面手机放哪里等了两天，说不到更换的条件！那个灰说不影响使用，我又从店里拿回来，灰正好在主摄，谁知道会不会以后使用的时候会跑在哪里去了影响使用怎么办？看来华为的品控也不咋地，华为厂里的质检员也不负责质检，外观这么明显的也能放出来销售，如果不是手机不对焦拍不清楚，我高低得把图片发出来，我这个评论也不是恶意评价，平均两年买一个手机，还买了两个送人，这个手机12.12号激活，到现在12.16号，使用了一两天就放在手机店里检测，到最后说，没办法处理，也不可能拆机，我准备退掉的，但是我确实要用，退换需要很久，既然他说不影响使用那我就用着，但是谁愿意花几千块钱买个新机有瑕疵的？以后再也不会在京东上买手机了，从此粉转黑！plus会员也不会再开了
1,"本人在3月25日通过京东在华为京东自营官方旗舰店购买华为pura 70 pro + ，在使用过程中经常出现电话通话/语音通话中断几秒听不到任何声音的故障，刚开始以为网络问题，但持续性出现这个问题，便向店铺客服反馈，均未得到处理。周三客服回复一些操作，在拆手机壳的过程中，本人不慎将手机右下方刮了（不要求处理），但按照客服提供的操作故障仍未处理。便向客服再次寻求帮助，客服回复这个问题是由于系统和软件不兼容导致，同时本人也告知了拆手机壳过程中出现刮花现象，说没有问题。
4月4日收到京东客服反馈，由于手机刮花不能免费做任何维修？？？
这也不是本人第一次在这家店购买同款手机，2024年购买的同款手机无故障，就3月25日购买的这台有问题。
本人要求很简单: 系统故障问题，京东必须给予免费处理，外壳由于个人失误可不做处理。希望平台介入协助处理～感谢🙏"
1,好一个遥遥领先，好一个华为，我从十二月买的手机，当天收货没有检查好，开机用了一下，体验感不好，在当天的凌晨两点多，申请退货退款，第二天快递员上门取货检查一下没问题就收走了，然后过了两三天，在他们售后检测结果出来，就给我打电话说手机有刮花，不能退给我原反，我吃饱没事去刮花手机干嘛，快递小哥检查没问题就收走了，到你们这就跟我说手机刮花不能退，找平台，平台升级专员，专员打电话给我说，要查物流监控，物流监控还没弄好，直接就给我点击货物原反，平台介入踢皮球，店铺客服就是机器人，希望各位买他们家的手机，记得拍照🎥，保留证据，不然他们是不给退货的，而且态度真#强硬，一句手机没问题，就是你刮花了，不能退！！！遥遥领先，破手机。手机在运输和检测时间一共三天，他们收到货的时间是当天晚上，第二天十点检测员就开始检测，一直到下午两点多打电话给我，说刮花的事，我当时肺都气炸了。他检测一个手机需要那么长时间吗？最后奉劝各位，买手机要记得拍照留证据。
1,劝各位在京东买华为的手机慎重考虑，华为手机的品控极差，到手不到十天，出现后盖和中框开缝脱胶的情况，第一时间申请售后进行换货，手机使用的很小心，全程套全包软壳使用，房东取走之前特意拍视频留证据，我到了京东售后那里，手机就变成了有轻微损伤，以有划痕为理由拒绝换货，已经维权十天，目前毫无结果，农方面逃避手机质量问题，拒绝售后强词夺理，态度极差，这还出现了在拒收包裹后，快递站点私自拆开包裹，拿出手机查看的情况，去各大平台搜索类似的情况特别多，只要是出问题的手机在京东购买的。退换你想都不要想，到售后那里手机必有伤痕必有划痕，售后是真恶心啊，故意损坏手机来拒保，我有的是时间，我这次一定要和京东死磕到底。那到最后是起诉我都要跟京东死磕到底，我豁出去了，花着新机的价格买到了一个瑕疵机。可恨的就是，本来没有任何划痕，到售后那里就变成了有划痕，而且客服也亲口承认了，通过我的证据表明看不出有任何伤痕。但又说啊我们是拿强光手电照射的，肉眼看不见伤痕，需要在强光手电下照射，看到了0.1mm的伤痕。问了大家都是以这样同样的理由拒绝的。有的甚至连划痕的位置都一样。这京东谁买谁被坑
1,用过挺多手机了，OPPO、VIVO、小米、苹果还是华为都用过，这个手机是我目前用的体验最差劲的，没有之一，我不知道别人用的体验感如何，在我这里体验感真的处处踩雷，我就用了十多天，就一堆的问题，我给大家总结总结，没有买的可以做一个参考。问题如下：1.刷~时突然卡屏，而且是特别卡，需要大退关了后台再进入，这个问题绝对不是偶然，到现在为止刷~时间长了依旧会卡。但是退后台重启都会回复，不刷~或者不介意的可以无视。2.我是喜欢玩手游的，这个手机玩手游时居然会失声，就是玩着玩着队友突然听不到你说话声音了，或者队友听着有杂音，吃鸡、王者、三角洲都一。样，这个真的头大。3.~视频不能保证每次都能出现在别的软件上方，而且~视频过程中，如果遇到你打开的别的软件有声源的话，~视频或语音也会失声！！！这个也是非常头大的，这个我真的想摔手机。4.对于新手机来说这个手机续航我觉得也不是很理想。不过充电确实快。我之前本来是一个苹果一个华为手机，主用苹果，想着换个华为手机以后主用华为的，结果我还是错付了，这个手机给我的体验感甚至不如我之前的mate30，总之慎入，尤其苹果转华为，可以看看其他的
1,预计10月19日送达，整个19日可以说完全音讯全无，配送员电话打不通，配送站点电话也打不通，找客服反应情况，客服回复晚点给我回复，直到10月20日也没收到客服回复。再次联系客服，完全与19日回复的一模一样，很敷衍。然后通过电话联系客服，跟线上客服差不多，敷衍、推诿。10月20日多次投诉后，于当日下午17点过才给我送到快递公共服务点。配送员放到服务点也未电话联系我，还是我自己去找到的包裹。拿到包裹配送员给我打电话，说是打了我好几个电话，我叫他把通话记录发给我看，也没发。反正感觉就是在欺骗消费者。预计不了送达时间就不要预计，当日送不了，出于什么原因，可以直接联系说明情况，我可以自己去取。什么都不说，也不配送，找客服也相当于没找。一个字，气。很不爽的一次网购，谢谢京东给我这样的体验。
1,别买  拍照实在难看 又黄又没神的那种  特别是眼镜那个部位特难看  还有那个微距镜头特讨厌  每次拿出来要紧急拍个照片时  总得先按那个关闭那个微距 不然拍出来是模糊的 总之拍照这一块特不方便还特难看 还没有老的华为手机拍出来的照片好看
1,笑死，买回来后发现mate70更新想着退货买mate70，客服爽快答应，寄回去又说有划痕，不支持退
1,垃圾，买了不到一个星期，降价400，保值率堪忧，性价比垃圾，当时在拼多多跟淘宝百亿补贴已经可以比这家便宜800，因为相信自营旗舰店才买的这家，没想到这么不堪，定向割韭菜，第一次购物体验这么垃圾
1,1月2日买的手机，到现在手机跌了五百多元，还不能补差，才一个星期，京东自营店太不地道了，真是亏大了。
1,这个商家极差，强制消费者消费，买了后面说不支持退货，这个是商家给的回复，给我整无语了，选择在京东买就是因为信任，这个商家搞得确实挺让人失望的。各行各业都不容易，套路太深了搞强制消费者，
1,本来对华为有很高的期待，支持国产的，结果用了不到一个月，动不动黑屏，消息延迟，我都怀疑是不是用的低配的芯片，欺骗国人，品质根本跟不上价格，要买的慎重，六七千买个低配，特别划不来，退也退不掉，简直气死了
1,"1.手机拿到手就后盖玻璃没有封紧，找华为售后，人家要你找京东客服
2.售后打电话，人家华为大公司，直接告诉你不影响使用，胶水没打到位，机械打的，你们出厂没有质检员吗？
3.刚刚到手就这样的售后态度 ，要是有个坏，或者什么问题，别想有好的服务，
4.已经踩坑，想买的考虑清楚，值不值得"
1,回收旧手机发优惠券完全是套路，正常使用五年的手机，专员上门了还一定要发京东快递回收，然后检测连通话功能也不行硬压到三百以下，买的人自己考虑哒
1,像素差，~拍视频拍的时候清晰，发出去就变模糊了，寄出去检查给我说一切正常，70的像素还没有40的像素好，居然还没有苹果11的像素好，当时就是看打广告说它像素特别好才买的，不知道花这么多钱买这个有何用，180天内说的换新也不给我换，最差的一次网上购物体验，再也不会我网上买手机了，再也不信华为像素好了。广告都是骗人的，售后也很差，爱答不理，感觉我没事找事一样
1,翻新机，12月刚买的，保修期是9月17日，客服说都是这样的，如果有同样问题的，请告诉我，我认了，别自己人坑自己人？！
1,"肠子都悔青了，买个这款Pura 70 Pro+ 
一：掉电快
二：充电发热严重，真害怕炸了
三：拍照还没我oppo find X系列好看
四：为什么我买的信号时好时坏？之前用其他牌子从来没有这种情况😓
五：后边摄像头太大了，图片看不出大，拿到手真是难看。
六：14天掉了400元，也价保不了"
1,第一次买华为手机，收到货发现群聊打视频开不了摄像头，然后换货，换货回来，这手机喇叭又出问题，别人听不到我说话！换货回来那天激活去搜索的保修期，发现激活时间要早两天，真怀疑官方是把退回去的手机重新换货给我的，太差劲了
1,"千万别买，质量有问题，
用了一个多月，屏幕就坏了，也没人解决，诶"
1,人麻了！拿到手两天今天才拆开发现镜头里面有灰尘！再也不买华为了！
1,最垃圾的一次购物    昨天手机降价  我还在价保时间内  找客服  客服不给我转人工  一直说等回复  等到今天还没回复  我又找她们   就说已经过保了   这不就是你们的套路吗   故意延迟顾客的价保时间  你们不就不用赔差价了吗    京东最垃圾了   以前挺信赖京东的  现在搞的真垃圾  呸呸呸
1,不到1米摔下来就这样了，什么玄武昆仑钢化玻璃，说的跟真的耐摔一下，太失望了
1,真不想说什么，本来一个黑点的给我修出两个黑点，
1,此用户未及时填写评价内容
1,这么拉胯的吗 新手机 屏幕有水印 这服务态度也真6
1,此用户未及时填写评价内容
1,此用户未及时填写评价内容
1,收到商品没有说明书，找客户进行确认回复有说明书可能是自己弄丢了，电话咨询客户一些问题例如手机怎么设置清理后台程序的，回复手机就是这样的，既然都是这么个态度，我强烈要求退货。
1,不太建议大家买华为，买了我都后悔了
1,真的是服了，打游戏说话都听不到，我网上收了也是一样的，我发现就是 p70 通病，售后也不解决，买回来十天就这样了，真的是服了，再也不相信华为了
1,很差！说好了~晒单送包也不送！现在直接买的都送包，费半天劲拍照写了半天评价到头来跟我说名额满了！客服也只是复读机，不起作用。手机耗电也特别快，还不如我原来的14pro。打原来手机畅玩的剑三无界也卡顿严重。
1,非常的影响心情，有些活动也不是非做不可，估价1600，回款760 ，不以旧换新7199，现在付款7499。自己看图，建议不要在京东买。收到快递时快递盒子如图所示。和爱回收联合欺骗消费者，和爱回收联合欺骗消费者
1,"卡，无语😑
运行速度：卡无语，才买一个两个月游戏都不打，我真服了"
1,才用两个月不到，后面就磕坏了，这让我怎么相信国货，我的苹果用了3年经常摔从来没有坏过，后悔死了
1,新设备屏幕上有污渍残留？还是硬的痕迹。没有插卡等候京东给出合理解释。
1,没买7天就改活动不改价格只赠送价保让你用不了问客服就是#你谁让你买的早不等双11如果不是宣传一样谁提前当然会等双11啊
1,到手就降价，还说现在保价30天，故意来气我。降价也没消息没个通知。手机发热严重，怀疑京东买的是假货，拍照还没有4年前的p40清晰，电池不耐用，在京东购物体验感非常差，这种客服不解决问题
1,不知道其他人买的待机时间怎么样，  可是我买来的代理时间不怎么样。
1,此用户未及时填写评价内容
1,这个华为p70Pro+真的是电量不经用，没玩游戏没刷视频，没听音乐。就充电一天仅供日常使用掉电太快了。
1,呼吁大家去线下买吧，线上比线下最少便宜 800 元！
1,此用户未及时填写评价内容
1,非常差劲的一次购物，线上线下价格差太多，买了就别想退。
1,一般手机配的都有耳机 这个破玩意得单独购买 vivo配的还是蓝牙耳机 扣成这样啊
1,9月20号下单，7199元，27号就降了300块，华为只保价7天？退差价？根本不可能！本来支持华为才买的，太寒心！！而且刷视频电池发烫！
1,此用户未及时填写评价内容
1,此用户未及时填写评价内容
1,第一发货屏幕严重划伤，还不给退，机子不是很好用，有点卡，刚买完就降价，大家慎重买，对京东有些失望，还是建议大家去实体店买
1,支持国货，国货看我是usb。非常不保值，降价离谱（京东自营)。手机本身没啥问题
1,手机好用，但是售后服务差，这点华为就打折了。
1,此用户未填写评价内容
1,屏幕有花點 現在不知道會怎麼處理
1,手机买不到一个月前置摄像头有一个黑点
1,前像机一点不清晰
1,降价很快，以旧换新根本不配价保，客服也是机器人，手机发烫严重！
1,刷脸解锁极差，还不如p40
1,这个发热让我有一些失望，看个贴吧，手机非常烫手，这是不是太夸张了？
1,一颗星，谁让这个掉价这么快呢，不到十天便宜了500元
1,还不到半个月就降价这么多&hellip;&hellip;
1,以旧换新的估价都是骗人的，估价非常低，不同意也不行了。
1,太他么坑了9月21号到的今天打开京东一看就他么这个链接贵差的最多的得有500块
1,体验感特别差，店铺客服和京东客服一天推卸责任
1,七天无理由退款是陷阱，京东上门取货，拿走后打电话告知客户有划痕
1,此用户未及时填写评价内容
1,刚买第八天就降价三百！垃圾售后！亏我扔了苹果换的华为，脸疼！！！
1,此用户未及时填写评价内容
1,此用户未填写评价内容
1,此用户未填写评价内容
1,一点都不好用，真#
1,此用户未填写评价内容
1,此用户未及时填写评价内容
1,此用户未填写评价内容
1,此用户未及时填写评价内容
1,此用户未及时填写评价内容
1,此用户未及时填写评价内容
1,此用户未填写评价内容
1,此用户未填写评价内容
1,此用户未及时填写评价内容
1,此用户未填写评价内容
1,价格降得太快
1,一个月不到降600
1,此用户未填写评价内容
1,品控#。
1,壳子太硬了
1,费电快得很
1,其他问题不说，因为任何品牌新机到手都顺滑，但是感官很不好的一点，七千多的手机，刚到手一周，手机膜中间起泡，是你们的质量问题，售后处理方式只有前往门店付费更换，店大欺客！
1,被车压过的东西都变形了，还发过来真的无语，差评
1,以旧换新：差评，用京东那么多年真是套路越来越多，买这个机子多花我几百块。手机以旧换新补贴加一起给噱头3500回收。实际到了质检只给1500。我随便二手回收都能给2800。最后一份补贴都没有！！差评
1,差评，降价太快，而且不补差价，点的分期免息也莫名其妙的不分期了
1,售后极差极差极差
1,打个王者都能卡死什么垃圾手机，本想着高高兴兴买个华为手机没想到啊万万没想到七八千手机卡屏了我笑了
1,产品还可以，但是客服态度太差了，根本就不解决问题，我的~电脑登录后手机不提示，他就说是~问题，我去华为官网自己查才解决的，店铺客服太不专业了，气死了
1,总的来讲不是一次好的购买体验，手机在户外会发热，掉帧，亮度无法调节，续航还可以，还有发现一个点，手机两侧的黑边框不一样宽，身边人的70是等宽的，去售后被解释为没有问题，总的来说，不是一次好的购买体验
1,7千多买的手机，用了不到一个月就出了问题，换货流程各种卡，反正就是自己想办法去处理就完事了，真是绝了
1,用了一段时间了，失望至极。以后再也不买华为了，宣传这么牛，各种测试，昨晚从床上掉地上了，还带着壳的，都没当回事，刚刚看到侧边开了一条很明显的缝，就算纸做的，你卖这么贵，就不能沾点胶水吗？这么低一摔就碎，真服了，真差
1,现在便宜了
1,一星都多，一直用京东这才多久差一千多了
1,此用户未填写评价内容
1,这商家是**，买的时候说12期免息，买完跟你要九百多服务费，七千多手机收九百多服务费，垃圾店家
1,买了还不到一个月就降价了   找客服也没人理  全是机器人回复  反反复复就那几句话
1,新手机卡1无服务，尝试许多方法都没有用
1,不建议大家买，这个被吹上天的手机就刷个视频手机都发烫特别严重，还得用风扇降温，买了两个月不到，屏幕已经磕坏了一点，原来买的vivo用了4年不管怎么摔屏幕都没坏。非常后悔，下次不会再买。大家不要盲目跟风，谨慎购买。
1,此用户未填写评价内容
1,此用户未填写评价内容
1,才买没多久就降价了，买的时候没有注意有保价这个服务，申请不了
1,什么垃圾手机，放大后拍照根本没那么清晰，电梯里根本就没信号，虚假宣传。还有，买的时候八千，不到两个月时间，降价800块钱，@个人了。
1,没有任何保障，买完一周便宜好几百，没法保价 也没人管 踩坑
1,刚买了没几天就降价，还不给解决，妈的真够#的，客服一个比一个会推，大家都别买
1,此用户未及时填写评价内容
1,真垃圾，还是今年的新品，6月买的7999，现在才40多天已经降了1000。不给保价原因是已过保！拍照也没有营销的那么强，吃相难看！
1,此用户未填写评价内容
1,#质量太差了，才买一个多月，今日去贴膜才发现屏幕与机身的密封条都露出来了，据说汗水都有可能流进去，都不知道找哪个进行处理。太失望了
1,此用户未填写评价内容
1,套路太多，再也不相信京东了。旧手机预估1050，结果寄过去之后只估200块。完全就是套路。
1,莫名其妙降价800元！！！！人工客服跟机器人一样 耗到你失去耐心为止 根本不为用户着想。 华为这波太败人品了 京东客服也一样
1,此用户未及时填写评价内容
1,想要买这个手机的宝子们还是考虑一下吧，这款手机挺差的。我刚买了一直没有去试这个相机，也不舍得用，就为了拍照片录视频。好不容易等到了偶像的演唱会，我还是买的内场票，结果发现4倍之前根本拍不清楚，4倍之后根本就看不清人脸了，跟客服说，客服也不解决这个事情，就一直推卸责任，说是我的问题。我真服了，我是制造手机的吗？手机出现问题居然说是我的原因？我当时花了8000块买的手机，还没有人家5000买的手机的像素好，什么意思？华为现在是飘了是吗？就这样对待消费者？出问题就推卸责任不解决？差评送上！
1,此用户未填写评价内容
1,差评差评，刚买到没多久，就降价800，有活动又不提前说明，第一次选择华为，太让我失望了
1,上下滑动文字会加粗模糊，看两篇文章就会眼晕#，工程师非说没有问题&hellip;&hellip;拿别人华为手机看屏幕没有这样的问题，这个问题为什么不能换？不能换请退货！7999元买手机，屏幕有明显问题不能换不能退？华为的品质还能不能让人信赖？
