评分,评论内容
3,手机没啥说的，就是产品搞回来以后，包装太脏了，藏灰不说，大片大片的印渍，客服只会说不满意可以退，哎
3,花了大几千买了一手机，顶部外观居然有一处明显刮花痕迹，一次不愉快的购物体验。
3,感觉也一般&hellip;.信号一点也没改善同一个地方同一个运营商反正就是信号差
2,你家的充电头也不送，钢化膜也没有，就一手机，你告诉我怎么用？
3,后面才发现摄像头边边一块小的掉漆 后面还发生手电筒不亮了 其他的体验还好
3,硬件配置都不一样，前置什么利伟科技，屏幕什么的都是次的
3,手机正常，但是库存机，手机盒也有污损，快递最外面包装收货的时候已经皱巴巴的了。
3,首发就是lg屏幕  炸裂
3,摄像头有灰尘，边框有一个小印子，已经拆了估计也不好申请售后将就用吧，苹果的品控越来越差。
3,运气不好，喇叭有点划痕，还好不是完美主义，换来换去也麻烦
3,外形外观：一看快递盒就是那么的卑微，感觉像拆开过。客服说没事正常
3,买16PROMax的最次的配置啊，电池：欣旺达，屏幕：GH3，硬盘：TLC，摄像头LG，京东发货但是很快
2,价格又降了100，不给价保。买了.看到发货的时候挺激动的，到了之后，满怀期不错啊！而且客服小姐姐也特别的好，很有礼貌，客
3,毕竟是最新款手机，用了几天感觉电池续航还是不尽人意，远不如当初用的第一部苹果6P续航强大。
3,第一次在京东买手机，能去店里还是去店里吧。虽然是旗舰店但是手机还是不太行的样子，按键卡顿
2,"翻车了，那么大的白点，拍照摄像会卡顿
其他特色：信号贼差"
3,边框有点小划痕！送货速度很快 包装也很完整 就是这个边框有点小划痕 因为嫌麻烦就懒得退了！
3,不是很好用，今天拍照会闪退，有时候刷视频会卡顿，还没声音
3,不知道是天气热的原因还是手机原因，没玩多久就发热了，其他的都还好，总之充电挺慢的，
2,总体体验不好，有问题得不到实际解决。边框和后盖之间有明显缝隙也只是机器回复了个方案。
2,其实挺一般的 没有想象的那么好，屏幕感觉不灵敏，其他还行
3,外包装稍微有点污渍，不在意打开了，现在玩了两天有大家说的通病两侧偶尔会有点断触。
2,屏幕断触 花屏 闪屏。联系客服 只能返厂修 不支持退货或者换货
3,刚拿到手，一下午闪屏好几次，又发现摄像头有灰，跑了好几次直营店去检测
3,一般，边框有两处小划痕，好在摄像头没进灰跟屏幕没划痕，不然就退了
2,刚到手没注意看，昨天晚上充电碰了一下库兹漏电，差点没给我电死
3,手机大体上没毛病，但是用后置摄像头在安静条件下录像时，会有很明显的噪音存在，换了一次货问题依然存在
2,当着爱回收的面发现屏幕有小磕碰，现在京东居然不让退换，不主动沟通，让我干着急。
3,不说了，10月1号买的，20天，降价500，旧机补贴，电池还是坚持不到一天，还时不时会卡机！
3,"手机没的说。IOS18真不好用，18.01省电但控制中心就是一坨X.
18.1总算好了一点但耗电上去了。"
2,快递员没有给本人验货就打开包装📦，拿出手机操作，本人没有验机，感觉拿到一个水机
3,有点瑕疵，但系统没问题，反正应该心态的。苹果售后服务一般，京东客服服务不错，但是京东物流并没有给我送货上门！反而让我自己去领！！！差评
2,手机到手了质量很不错～速度很快，终于体验新机了哈哈哈哈，拍照功能也很清晰大家可以看看
3,避雷吧兄弟们！这款屏幕经常点不动 我还以为自己问题 结果换个设备发现就是手机问题😰还不如买15
2,咋说呢  用了一段时间感觉手机触屏反应好迟钝   而且朋友说这是压箱机
3,以旧换新翻车了，选择的是二次上门全额付款，但是还是一次上门的方式，价格确没有享受到一次上门。
2,这么贵的机器刚收到机器.上面两个点擦不掉.不知道怎么回事.说开机了不能换.
2,不思进取，3年换机，跟13几乎没有任何变化&hellip;要不是在国外要用，苹果就又流失一个20年老用户了
3,双十一买的感觉比较便宜但是没想到没多久江苏就有购机补贴，好亏呀 手机还行。一共买了两有一个打开有灰尘就换了一个
2,"手机用着确实不错
虽然是未拆封的   但是外包装上面明显有灰尘污渍  8800+的价钱买到这样的服务确实不太值了 😅👎"
3,盒子都是脏的，还是里面拿出来的。外包装也是一个盒子，和之前买的盒子都不一样，不敢用。怕是假货，京东管理现在也越来越做的差了，
2,手机屏幕有小划伤，没有外物影响。 只能说这个型号的苹果屏幕质量差
3,总体还行吧，就是屏幕垃圾，gh3的，倾斜屏幕发绿，触控不灵敏，，没我的14丝滑
3,收到东西注册完显示是新手机，但是保修日期和激活日期对不上，还要自己上传发票啥的，让人觉得有点麻烦
2,商品寄来盒子变形，买来送人的，哪个愿意买新机子，包装变形，咨询商家就简单回复一句没事正常。反正心里有点不舒服。反正体验不好。
3,苹果手机的设计师，没有800年脑血栓想不出来这些设计，许多设计就死板僵化完全不考虑用户的实际体验。
3,还**，就是会偶尔断触，手电筒打开不亮，相机打开黑屏之类的吧
2,最差的LG GH3屏幕
2,屏幕LG，电池英伟达，前摄富士通，硬盘东芝，几乎集最差于一身，京东你可以哦😠
2,莫名卡顿，莫名关机，小毛病有点多但又不常发生，整不明白什么意思
2,"以旧换新：爱回收小哥服务态度超级好也没有压价非常赞
外形外观：新机拆开有瑕疵，客服解决问题不行
其他都没有什么问题蛮好的"
3,手机收到货有一小块磕碰，退货又懒的折腾了，联系客服已经解决了，就是觉得新手机怎么回🈶这种情况发生，后期使用看看吧。
2,未拆封的机器，但是用了几天手机问题一大堆，莫名掉帧、卡顿、降频，售后查不出问题。
2,14pm置换过来的，使用体验没什么变化。充电是一如既往的慢，还有各种bug。三星的G9N屏幕偏黄！
3,手机到的时候，手机盒四角是黑的，像是这个手机是被在货架上来回摩擦的那种，而且手机盒的两个盒不像原装那样，看着就是不舒服的感觉，但是我还是没换，因为从西藏退货在补发的话，来回其码半个月了。
2,灵动岛上面一群小白点，为什么中间有一颗不均匀，想里面有什么东西破了
3,屏幕灵敏度反应有的慢，正常调好的闹钟还会偶尔没有声音，没想象中那么好
3,"手机是不错的，只是前后差价太大了，认亏好几百
现在活动太频繁了，还是要管住手，忍一忍"
2,感觉信号不是很好，空旷地方，有几次没有信号，朋友的手机就有信号
3,手机买来，这样包装很有问题，虽然没有什么问题，但是新买的手机，搞得跟地上捡来的一样，很不舒服
2,屏幕混用，显示效果不如上一台，差很多。边框瑕疵。这么贵以后还是实体店买吧
3,断触问题有点难受，用了这么久，续航还是欠妥。售后还是挺麻烦的，建议优化售后流程，向其他平台一样
2,收到货当天没拆开看  也不知道是不是新机 左下角屏幕有磨损有一开始以为是屏幕保护膜留下的胶 结果用酒精棉也擦不掉
3,屏幕断触语音识别不了，相机拍照键要打开之后要实缓两到3秒才行续航挺给力的
3,信号一如既往的拉垮，在家都能空信号。续航一般般，不是特别推荐
2,有划痕，在也不敢在网上买这么贵的手机了，还是得去店里，苹果真是越做越不行了
3,😭😭没有抽到三星屏是 lg 的，摄像头也没抽到 lg，京东买东西我还是比较放心，就是价格太高了，而且保价不好，不保卷，不是刚需不建议
3,拖动屏幕时，有条白色横线一闪一闪的！是图片问题还是手机质量问题？以旧换新，手机昨天刚拿到手，大家帮我看看。
2,相册有bug 编辑过的实况完成在长按就卡住，或者在编辑中会显示储存照片出错
2,还用了没多久 会偶尔闪黑屏 体验感不好&hellip; 除了这个问题 其他没啥问题
3,刚买几天，就出现音量调节失灵的现象！问了客服，直接就机器回复了一句，让自己查原因，搞笑！
2,品控不是一般的差不知道为啥，手机屏幕跟中框缝隙会有a4纸那么宽背面也一样，基本都会有，希望以后品控做好一点，其他的都还是是可以的
2,不太满意的一次 手机收到有点小瑕疵 还没激活完成自动关机一直黑屏闪苹果logo
3,一开始双卡不能用，升级系统后才可以，还有屏幕一直断触，到现在都没解决
3,"1、京东送货延迟，多次跟崔体验差
2、手机边框有金属污、清洁不掉
3、以旧换新回收上门价格低影响心情"
2,原本就是贵重物品却没有标识，箱子里面的防撞袋也没有包严实，快递员没有轻放，直接用力扔在地上。😠😠😠
2,手电筒打开不亮有延迟，摄像头按键也是，打开黑的，按键有时候也不灵敏
3,体验感不好，盒子很脏，不知道是不是翻新机，第一次在京东买苹果手机，虽然外观无痕迹，但是第一感觉给我就不太好
3,有点贵了没别的平台价格好  手机本身还是顶级的 续航一般般  显示很棒但是抽到了lg屏幕和专卖店对比了感觉差不多先用着吧  报价也只有7天感觉后期降价空间很大 等不急了买  没抄到底
2,续航没有15promax好  而且容易断触 发热也就那样 没什么提升
3,换了很多次摄像头里还是有灰，换不动了。感觉换来换去，这一代摄像头也会是通病。
3,断触，发烫还是有点，而且一过热就停止充电，屏幕亮度也会强制调低，挺难受的
3,前三张是14拍的，最后一张16拍的，目前觉得16触摸反应慢，手机拍照没14好，其他都差不多，沙漠金感觉是以前玫瑰金的感觉。
3,手机是好，没有问题，可是分期付款免息存在诱导，套装购买不享受免息，没有留意看就增加了1千多的利息，实属不开心
2,手机用着没毛病，就是镜头有个小灰尘，左上角有个小磕碰，第一批质量还是不太行
2,有瑕疵，背面有划痕，费时费力去投诉换新，不只一次在京东买到瑕疵商品了，只能说到手都先验货吧 不然一踩一个准
3,"新手机外表没问题
内部经软件检测后发现各组件一般
系统适配各App还有不少Bug"
3,是零售机全新未激活 但是手机边框有一条小划痕 懒得计较了 概率问题被碰上了 谨慎选择
2,1万块钱从线上买个手机，体验感有点差，盒子不知道经历了什么，如果不是急用一定退了，里面还凑合，就是不知道摔没摔过
3,一般吧，没有朋友的16pm续航好，她的一天一充还玩游戏，我的一天三充才刚够
3,总体感觉不错，就是机体喇叭附近有好几个黑点，像是氧化或者掉漆，懒得换，就这样吧！
2,哎～满怀期待的接收，结果发现摄像头里面有一粒灰尘，虽然不影响使用但是总感觉很闹心。
3,苹果手感一如既往的差，屏幕低频瞎眼敏感的不推荐，其他的大差不差，性能也没那么好，不急的推荐下一代
3,机子拿到手之后，使用了一次发烫，准备退换，说再换货，可能还是这样的，我没办法，就这样了
3,手机耍了一天，感受就是电量还是不够用，用的很快，发热效果一般。还有就是网络也不是很好。
3,早知道发热这么严重就不买，玩游戏手都烫。还不够安卓机散热做得好，唯一优点就是直屏大机爽
2,手机在拆开包装后，摄像头上存在灰尘，屏幕也有擦拭痕迹，因此可以判断为后封机。我是以旧换新，由于旧手机已经验过，且我期待使用新手机，所以没有提出异议。
2,介绍说能连续播放视频33小时纯属胡说，我就冲这个买的，10个小时都不能！不怎么玩的情况下最多只能待机24小时
3,一般吧，目前除了会屏幕断触其他暂时没什么问题，充电一般一天充一次，偶尔两次
3,还没有激活，只是在看外观 充电口有使用痕迹，我换货，客服来电话说能擦掉吗！我买的是新手机，新手机！
2,边框有划痕，由于连了一下网，没注意检查，造成无法退换，虽然京东给申请了电池保险，但毕竟一万多的新机有点划痕总有点不舒服，购物体验感确实不好。
2,第一个手机出厂信号有问题换了屏幕，第二个手机买来打不开电池页面，重启后算是解决了，两个手机踩雷一个，好倒霉，慎重吧
3,到手就发现手机有瑕疵，后盖玻璃边缘处有一个大黑点，幸亏没有开机激活，已经申请换货了，希望能换到一个完美机
3,没有划痕磕碰啥的，不过有个摄像头有点泛黄，不影响使用到是，还是你会在心里了2分钟可
2,国补价格入手九五88，网上看了很多翻车案例，没想我我也是一个，买了这么多年第二次遇到，上次是去年双十一也是京东自营这家店15pm，入手的希望多加留意，看看能否接受。听筒上面掉漆，涂层有5mm没有电镀上，不换了嫌折腾。
3,新手机刚拿到手，发现有一个镜头圈掉漆，前置摄像头有灰尘，不知道有没有像我一样的小伙伴。。。
3,赶上3C补贴价格还可以，就是生产日期是去年的，这包装盒很脏而且都磨损坏了，机器屏幕膜也有气泡，还有细微的划痕，估计是别人退货的，但是实在懒得换了，但是以后在京东自营买手机要好好考虑一下了。
2,苹果手机性能强大，使用感觉一如既往的好，但是第一次京东购买的手机里镜头有个小灰尘，感觉很不舒服。这个差是给灰尘的，其他都挺好
2,新机卡屏，玩着玩着就不动了卡住按哪个键都不管用苹果8都没出现过这情况，真是越来越差，信号也不好
2,真是后悔在这里买，序列号是f开头的，都说不是零售机，输入法会卡顿，然后买完没几天就有700元补贴，还不给退差价，客服态度差，回复慢，奉劝要买的人提前问好有没有补贴还有一些后续售后问题，如果有问题怎么解决提前问好！
2,手机正常，客服服务态度不好，难沟通，还有以旧换新上门会减低你旧手机的价格，总体一般，因为要着急用手机。没去实体店卖手机。基本没有什么优惠可言。
3,边框有一点点瑕疵，被我擦掉了，问了客服说是打包的时候可能弄上去了，别的没什么问题，都挺好的
3,电池不是很耐用，偶尔花屏幕，会自动锁屏，语音识别有时候也会失灵！
3,散热没有改进，屏幕没有之前的耐划耐刮，一天就划出好多小细纹，还没人家用了一年的红米屏幕好&hellip;&hellip;.
3,东西不错 但是这个包装是不是有点太草率了 里面盒子脏一看就被摸过好几次了就不说了 这个外面的包装漏气了也不检查一下吗 手机倒是完好无损 但是外面的壳子真的一言难尽 别是别人退货的给我了
3,会还行吧，感觉电池不太行，不咋抗用啊，系统是挺顺滑的。续航和预期差距有点大
3,这是已经换过一次的了，覆盖手机的膜还是不服帖，感觉像是被人揭开过，激活好了才发现手机侧边有一道痕迹，懒得换
2,怎么说呢，手机还是很好的，是依旧换新，第一次是直接上门一次的，9号买的，16号还没有到，客服也一直拖。退了重新买的，还是以旧换新，但是这次是两次上门京东就是快，但是在给手机贴膜的时候发现屏幕上有划痕，要求客服换，说是换不了，这个手机我就等了7天，一直很耐心的等，最后等来这个，我想换成别人也不开心吧。上班发了工资想换个手机，却这样了，唉，但是还是感谢客服，幸苦了，但是还是希望可以给我换的
3,发生过拍照黑屏事件&hellip;&hellip;客服说重启，重启的确好了，但是不确定下次会不会还这样，上网查了，是系统有问题
2,收到手机不到一个月死机3次，第一次右键相机问题，第二次灵动附近有漏液的黑点，第三次发送视频没声音，要不是看在导数据复杂的份上真的是想退换。
3,耗电巨快  不知道是电池问题还是我的问题  快赶上我的13pro耗电快了  除了屏幕变大 毫无提升的感觉
3,刚买前两天，发现打电话发语音都有杂音，手机返厂检测，检测出来没有问题。现在将就用，看后期是否有问题
2,"有点发热
系统还是如此流畅
电池依旧续航不给力
能用半天多
依旧没充电头
希望苹果改进"
3,我不会验机  感觉不错  我没有搜什么号因为没搜到 今天苹果官网维修 就一个瑕疵我没在意 挺小的
3,说实话苹果手机没什么变化，变化那些功能不大，如果不是真的需要没必要去购入，电池不怎么耐用，打字速度总是卡顿，
2,用了一段时间了，不是很好，手机两边老会点了没反应，才买没多久就有这个情况了
2,"裸机使用断触 明显  避雷 16Pro max
不知道是没有优化好  还是硬件问题 
其他 外观 性能等  果子依然是第一梯队"
2,"不知道为什么一万多的手机，拍设视频时总是自动停止。经门店检测没事，但是就是视频没拍完自己就停止。
还是有问题，不然不会这样"
3,用了两天，还行，就是有两个摄像头里面有小的灰尘，不打光的话看不出来。懒得扯皮了，就这样吧
2,这个手机为什么给他两个星呢？不是因为手机不好，是因为当时搞得以旧换新。爱回收的以旧换新，压榨得太狠了。本来一个在各种二手平台卖的还不错的手机，但结果让爱回收给的价格很低。希望大家以后以旧换新时，多注意一下吧，2颗钱不能再多。这次手机虽然很优惠，但过程很艰辛。
3,按键边缘一圈有色差不知道是不是都这样？25年1月买的，手机生产日期是24年9月，库存机是卖不出去了吗？偶尔有点反应慢，没有想象的那么丝滑
2,千万别以旧换新，就是套路，什么***就是使劲砍你的旧机价格，然后开始各种扯皮，最后让你自己妥协，加***比线下实体店给的旧机价格都低，黑！！！
2,目前手机使用感觉尚可，但确实存在反应速度较慢的问题，不过屏幕方面并未发现明显问题。
2,断触明显，偶尔死机，打开包装后置摄像头处有异物，网络差，网速差，无线网络信号差！
2,"重启过一次；抖音视频有过卡针，淘宝购物车卡帧，触摸屏有时候没反应-不知道是app还是手机问题。
拍照也不咋地，可能是用过相机的原因吧。
不是之前习惯ios，早就放弃了。可能以后不会再买了。"
3,从14promax换到16，为什么信号这么差啊，14的时候没感觉这么差，16经常没网，这是普遍问题吗？还是我拿到的手机有问题！
3,"实话说，没有用过苹果手机。感觉这个价位比国产高端机并没有那么大的优势。
也就剩下系统和一些特有功能强。
显示屏，优势一点也没了。"
3,买手机一定要看仔细，最好在阳光下面看，不然的话开闪光灯看会有问题，周边一点问题都没有，但是屏幕边缘是有损坏，结果也不能售后了。
2,买的黑色版本，新买来第一天就套了手机壳，用了一个礼拜，发现掉漆，客服说外观问题不属于三包，没办法解决
3,第一次的货不对，开箱边款掉漆下次，再加边框颜@差明显，黑色偏金色了，卡槽有掉漆与焊点。没激活与撕膜直接安排换货了。
3,我是5月16号晚上8点下的单，17号中午12点收到的手机。但是查手机里面的分析报告里5月16号晚上9点半分析报告里有一个数据提取的报告（正常来说这个时候手机是未激活状态，我咨询客服客服直接回答他们看不懂建议我去售后）虽然手机没多大问题，但是心里就是有点不爽
3,不出意外也是后封的机器，看了一下没啥大问题，有一处轻微掉漆，一处划痕，送人的礼品没办法退了。就这样吧
2,双十一下单，然后京东没有货一直不发货，就是个搬砖贩子，等了很久才邮寄到手。然后打开盒子，原包装还磕了。然后手机所有配件都是LG的配件。这都不说了，现在没有20天又便宜了！！！真是挺2B的！
3,商品包装盒真的有点差了，外包装比较脏，手机盒角挤压到了，手机边框有划痕有遐思，有遐思补贴50，包括这个保价服务，兄弟们一定要记得在7天内看商品有没有降价，及时价保，如果可以我建议去官方购买，手机整体不错，上面记得我确实不是特别满意。
3,看到有以旧换新参与了一下，结果就是自己旧Iphone X屏幕明明使用正常，但却被判定为边缘破损，属于屏幕损坏，价格折半。原来500元的评估价格变成了250，补贴的100因为没到500标准取消，合着我一台正常使用的备机就值250块。
3,**号买的，25号才用上。从12号收到第一个机器，到24号换新收到第5个机器，共售后了4次，前4个都是外观瑕疵，终于第5个机器外观没问题了。给个中评吧，京东售后挺好的，不想换新了，可以退货。苹果品控一般，不是掉漆就是有印子。
2,只能说苹果16真的很一般，拍照相机会卡机出来，电池量跟14比没有啥区别，都差不多没有持久而且14都用了两年还可以跟我这个16比
2,没有想象的那么好，屏幕体验太烂，老是断触，我以为手机卡呢，充电挺快，电池也耐用，
2,手机到货的第二天就出现这个异常情况，后台没有打开任何软件，屏幕也没有唤醒，问题是怎么关都关不了这个声音，莫名其妙&hellip;&hellip;
3,外包装磕了个角我是真挺慌的 快递包装没想起来录，外面填充塑料都破了个。 录了个开机 目前没发现漏液啥的。
3,掉电有点快，续航不行后摄像头拍照不怎么清晰。前摄像头拍照可以摄像头还没有我以前用的8p拍照清晰有点失望这是缺点也有优点。速度快音质效果非常好色彩显示好
3,刚收到货，出现 bug，声音大小调节不了。系统升级就好了。虽然小事情，但心情有点影响，毕竟是新电话
3,用了也差不多一个月了 整体来说就还行吧  这个屏幕时不时就会卡死  怎么划都没有反应  这点真的挺气人的
3,买的京东自营店的产品，结果发货过来是百亿补贴的包装箱，百亿补贴下单比京东自营店便宜1000元左右，我担心产品质量，才买了自营店的，结果还是发了百亿补贴的货，幸亏产品没事，只是被吃了差价，心里不舒服，目前发现使用时，手机发烫，新机就发烫，后台关了所有app，发烫就没了。不知道正常不正常
2,看一会儿监控或者用一会儿其他的，发现手机发烫，以前用的时候都没有这个现象。毕竟还是1个W的手机，怎么会出现这个问题呢。又不是夏天，是冬天。
3,电池不够用，第一个晚上待机状态下耗电百分之三，第二晚上十点钟睡觉，早上六点钟看，待机状态下耗电百分之十二，看今晚上耗电多少了，
3,没有想象中好用，断触，还有相机打开延迟5到10秒，这些问题，我觉得不是这个价位应该发生的问题，拍照效果也一般。
3,其他倒是没什么，使用过程中屏幕老是有断触的情况，看个小说翻页时不时点不到，难道是屏幕太大的原因？同样作为官方存在，为啥不能实现无理由退换货。待机电量也不持久。
3,"屏幕音效：屏幕断触并且时不时花屏闪绿条
运行速度：有时候掉帧
待机时间：续航不行没有15pm好"
3,手机收到了，感觉和15PM没有本质上的区别&hellip;&hellip;&hellip;感觉存粹是因为官方降价了，担心二手15PM贬值过快，才换的16PM，凑合着用用吧。补2000多差价，也不是不可以，毕竟换新了
3,有时候屏幕灵敏度不高，点了好多次才能点到，其他的问题不大，对比15pm的拍照，16pm感觉还是差一点点东西，好模糊！
3,这款手机在触摸反应上略显不足，同时难以找到合适的保护膜。此外，相机功能偶尔会出现黑屏问题，可能是系统故障，具体原因尚需进一步探讨。
3,质保只有签收后的24小时 有点无语 24小时候后就是没有激活和没有开机都不能退换 等于没 有划痕和掉漆 大家收到货一定要24小时内拆包检查
3,这款手机是在2021年7月生产的，我是在2022年1月6日购买的。然而，我发现手机已经使用了6个月，这是为什么呢？我向客服咨询，但他们没有给我任何回应。客服表示这是按照随机安排进行的，这是怎么回事呢？因此，我建议您还是不要在这款平台上购买，因为可能存在一些潜在的问题。
