评分,评论内容
5,iPhone 16 Pro Max真的太好用啦！👍首先，它的外观设计简约大气，采用全新材质，手感细腻且耐摔耐磨。屏幕更是一大亮点，6.9英寸的超视网膜XDR OLED全面屏，色彩还原度极高，还支持120Hz ProMotion自适应刷新率技术，滑动屏幕和浏览网页无比流畅，视觉体验超棒。
5,正品，发货很快，安全下车。信号稳定性：信号稳定。屏幕显示：清晰显示。运行速度：老快老快。电池续航：百分之百。性价比：那是杠杠的。操作便捷度：很便捷。功能丰富度：苹果老粉了。
5,"外形外观：质感很不错，钛金属很精致，对比13pro很不错
屏幕音效：屏幕显示细腻，喇叭效果很好
拍照效果：拍照很清晰，录像顶级"
5,"运行畅快
拍照清晰
续航很好
嘻嘻，买了新手机好开心呢～(^▽^）让我来给你一个超级好评吧！哇～这个新手机真的太棒啦！它的外观超级时尚，拿在手里感觉特别酷炫，每次拿出来都能吸引好多伙伴的目光呢～(&ge;▽&le;）而且它的性能也超级强大哦！用起来特别流畅，不管是玩游戏还是看视频，都不会卡顿，简直是我的娱乐小能手呢～(~_~）最重要的是，它的拍照功能也太赞了吧！拍出来的照片特别清晰，颜色也特别鲜艳，让我每次拍照都能拍出美美哒的照片呢～(。总之，这个新手机真的太让我满意啦！不管是外观、性能还是拍照功能，都超出了我的期待呢～嘻嘻，谢谢它给我的生活带来了这么多乐趣！(。"
5,老公给买的新手机，习惯了用苹果机，其他都用不惯啦。这个16太好用了，很有手感哦，我就喜欢苹果的手感，有分量，有质感。用起来，京东高品质。
5,iPhone 16 Pro Max颜值超高，简约优雅尽显质感。搭载强大A18 Pro芯片，运行流畅；影像升级显著，拍照清晰细腻。屏幕显示出色，操作体验丝滑，大屏看剧超爽，整体表现堪称旗舰典范！
5,下单后1个小时就到货了，包装完好，很满意。苹果16 Pro Max太棒啦！性能超强，屏幕大且靓，拍视频超厉害，续航久，外观简约大气，超爱😍。
5,在使用苹果手机的这段时间内，我深感其卓越的性能和出色的用户体验。首先，手机的外观设计简洁大气，手感舒适。其次，iOS系统的流畅度和稳定性给我留下了深刻的印象，无论是日常操作还是运行大型应用都能轻松应对。再者，苹果手机的摄像头质量也非常出色，拍摄出的照片清晰自然。然而，苹果手机的价格相对较高，可能会让一些消费者望而却步。总的来说，苹果手机是一款值得推荐的智能手机，尤其是对于追求高品质生活和高效工作的用户。
5,这次在京东入手的iPhone真的超满意！下单后当天就发货，第二天一早快递就送到家，京东物流速度绝了！拆开包装，手机全新未拆封，三码合一，经过官网查验确认是正品，完全没有后顾之忧。开机后系统流畅，屏幕显示色彩鲜艳、细腻，拍照效果更是惊艳，不管是夜景还是人像模式都能轻松拿捏。而且京东的价格比线下优惠，还能叠加优惠券，性价比超高！客服服务也很到位，耐心解答各种问题。在京东买数码产品就是靠谱，以后换手机还选这儿！
5,京东入手iPhone 16 Pro Max沙漠色太惊艳了！磨砂质感低调奢华，钛金属边框手感一流，A18芯片运行丝滑，6.9英寸XDR屏细腻震撼，升级摄像头随手拍大片，续航超顶全天无压力。iOS 18新功能超实用，物流次日达开箱即用，正品保障安心购，果粉闭眼入不后悔！
5,这款手机真是太棒了！👍 外观时尚大气，屏幕细腻清晰，拍照效果也很出色。操作起来非常顺滑流畅，续航能力也不错。总之，是一款性价比很高的产品，强烈推荐给大家！✨📸
5,物流很快，物品完好无损，用起来很舒服，喜欢💕宝贝收到，物流很快，描述相符，比较满意，好评，推荐质量让人惊艳！精细的做工，优质的材料，每一处都彰显着高端品质，爱了爱了！
5,非常棒的手机 等了4年多才换的，在618大促的时候叠加了好多优惠，终于换到了心心念念的手机，整体用着非常流畅  非常推荐大家购买 高刷 加上岛，用着的手感比之前的12pro好太多了，而且这次换的是大屏的pro max体验很好
5,"外形外观：整体金属质感很强，又一贯的苹果的手感，很不错

拍照效果：新款相机夜景还是有很大进步，能拍的比较清晰
运行速度：整体运行流程"
5,"对消费者来说：在京东网上能购买到正宗的商品，无任何后顾之忧，是最大的快乐和心安。昨天在京东网上第一次给自己选购了iPhone 16 Pro Max, 因本人旅行在外，请朋友代收打开后苹果手机外观设计及包装都非常仔细漂亮，希望今后再次上京东网购买更多的好商品。
外形外观：漂亮与精致"
5,"以旧换新：便宜！把旧手机处理了
外形外观：真的好漂亮，钛金属也非常的美丽
屏幕音效：震撼，大屏幕就是爽
拍照效果：好看～新的摄像系统拍出来的照片很美丽"
5,"以旧换新：体验不错
外形外观：苹果最新款 新增ai按键
屏幕音效：屏幕是三星就好了
拍照效果：不错，三摄nb
运行速度：快得飞起
待机时间：pm待机很强"
5,包装完好，收到的机子是全新机，是国行正品全新机，打开没有任何瑕疵！摄像头也没有灰！非常好看！手感特别好！屏幕还是看苹果的高清啊，优化好啊，赞赞赞
5,换了16pm可太香！超大6.9英寸灵动岛屏，视野超广，看视频玩游戏超沉浸。A18 Pro芯片性能强劲，各类软件秒开，游戏满帧运行不卡顿。续航也抗打，一天一充无压力，真的爱了 。
5,京东物流配送非常快，早上下单下午快递就送达了 当面验收安心方便快捷。一眼就看中了沙漠金配色，实物质感非常好 阳光下淡淡的金属光泽，很喜欢 使用感好
5,摄像头成像效果很好，🙋🏻&zwj;♀️解锁方式是面容解锁，屏幕刷新率高，😁外形外观很好看，待机时间长电池容量大，送货速度很快🙋🏻&zwj;♀️
5,"外形外观：一如既往的好看
屏幕音效：很舒服，还是很好用的
拍照效果：牛的，像素很够用
运行速度：非常快，系统是顶级的
待机时间：还可以，比其他款好"
5,盼了好久终于入手iPhone 16 Pro Max，拿到手就被惊艳到。超窄边框大屏视野超棒，A18 Pro芯片运行超流畅，打游戏一点不卡顿。电池很耐用，一天使用无压力，拍照效果也很赞，爱了！
5,可以 速度很快 完美。iPhone 16 Pro Max采用钛金属中框和亚光质感玻璃背板，整体设计不仅轻盈耐用，还具备极佳的手感与高级质感。其6.9英寸超视网膜XDR显示屏，分辨率高达2868 x 1320像素，画面显示清晰细腻，无论是浏览图片、观看视频，还是玩游戏，都能呈现出色的视觉效果
5,"快递次日达很快，还是pm好用，大电池有安全感
屏幕音效：显示效果很棒，一直是米果双持苹果还是好一些的
之前用的15p，续航实在一般，换到16pm续航明显好多了"
5,"外形外观：非常酷，白色好看
屏幕音效：音质杠杠滴
拍照效果：强中王者
运行速度：很快
待机时间：刚刚体验，应该不会失望"
5,趁着618优惠，终于入手了16PM，首先颜色纠结了很久，还是选择了白色。对比15pm，发热好很多，续航和拍照好很多。最后屏幕黑边小一些。
5,京东 618 购买 iPhone 手机体验太棒了！手机收到后颜色正，手感轻薄，屏幕清晰，拍照效果惊艳，尤其是夜景模式。性能流畅不卡顿，A15 芯片加持下办公和学习效率都提升很多。性价比超高，推荐给朋友了！京东 618 购买 iPhone 手机体验太棒了！手机收到后颜色正，手感轻薄，屏幕清晰，拍照效果惊艳，尤其是夜景模式。
5,很轻薄质感很好屏幕效果oled屏护眼很舒服，电子产品果真买新不买旧，用着体验太好了，不过中度使用的话一两天貌似也没问题，苹果的手机，真的非常好用，一如既往的好用，完美，后续配个外设，正常办公是没有任何问题的，反应灵敏
5,这款手机实在是太赞了！📱 摄像头性能超级强大，拍照效果完全不输专业相机。而且使用起来非常顺手，流畅度一流。特别是搭配这个磁吸充电器，简直是绝配！🥳 推荐给所有追求高质量生活的小伙伴们～✨
5,昨晚在京东旗舰店下订单，今天上午就送到了，连同一起买的倍思康宁膜，初步检查是新机，正在导数据，比原来14速度提升了不少，膜和手机壳还是性价比很高，至少保真是康宁玻璃，不会太炫，但是材质放心，天天拿手上，安全最重要。
5,"🌟这次购买的是iPhone手机，黑色款非常酷炫！✨手感不错，握持感很好，系统流畅💨，拍照效果超赞👍，特别是夜景模式下拍出来的照片太美了！📸
🛀包装完好无损，物流也很给力，很快就收到了。这次购物体验非常满意，京东的服务也一如既往的好👏。期待下一次再光顾哦！🛍️"
5,物流太快了，发货第二天就收到了，本来还以为会要等个一星期，没想到这么快，手机性能太强大了，非常流畅，玩游戏根本不会卡，魅眼屏完全不影响，占屏比非常高！！拍照效果也特别好，去迪士尼随便拍都很好看！！绝对是今年性价比之王！！
5,这款手机简直太赞了！外观精致时尚，手感超棒。运行流畅不卡顿，拍照效果堪比专业相机，续航也很给力，完全满足日常使用需求，性价比超高！
5,在京东大品牌购买的值得信赖，到手就到售后去鉴定了一下，客服说是正品，价格不贵，618给自己最好的礼物，运行很快，电视观看不卡顿，新机没有划痕，拍照像素清晰，美感十足
5,手机特别不错，自用的max白，买台黑色给老婆用，拍照特别厉害，清晰，物流特别快，隔日达，京东自营值得信赖，品质不错，外观特别好看，够大，打游戏追剧必备，屏幕够大
5,趁着618活动拿下iPhone 16promax，价格非常实惠，而且物流非常快，5月30号下单，5月31号就到了。这手机外观简约精致，握感舒适。处理器性能强劲，运行流畅不卡顿，高像素镜头拍照超清晰，续航也很顶，超满意！2．入手后体验超棒！影像系统强大，夜景拍摄也出色，电量耐用，一整天都不用愁。3．手机质感没得说，金属边框很有档次。快充回血快，日常使用很方便，系统简洁易上手，各种功能都很实用，爱了。
5,这款iPhone 16 Promax 白色真是惊艳！屏幕细腻，色彩逼真，性能强劲，拍照效果也非常出色。背部设计简洁大气，握感非常舒适。无论从哪个角度看，值得入手！
5,这款真的太让我惊喜了!外观和图片一模一样，质感高级，细节处理精致。使用体验超棒，特别实用，完美满足了我的需求。卖家发货速度快，包装严实没有破损。客服态度也很好，耐心解答我的疑问。性价比超高，推荐大家购买!以后还会回购!
5,性能方面，A18 Pro芯片简直是个&ldquo;性能怪兽&rdquo;，不管是玩大型游戏还是多任务处理，都丝滑得像德芙巧克力一样，毫无卡顿。各种高画质游戏轻松驾驭，帧率稳得一批，发热控制也相当出色，再也不用担心玩一会儿手机就变成&ldquo;暖手宝&rdquo;了。
5,手机拿到使用后感觉非常的棒，网上说的不良问题都没有出现 。pm续航挺好我都是两天一充对手机中度使用者很友好，屏幕清晰流畅没有任何外观瑕疵。 爱了，京东自营店有保障，客服态度也挺耐心，搭配我买的原装充电头体验感满分!
5,这款手机真是太棒了！📱💖性能超级强大，拍照效果也非常出色，电池续航也很持久。使用起来非常顺手，完全满足我的日常需求。强烈推荐给各位小伙伴，入手绝对不后悔哦～😊
5,"正品保证，全新无痕，好喜欢
以旧换新：好用
外形外观：真好
屏幕音效：好
拍照效果：好
运行速度：块
待机时间：长
其他特色：好
17要出了，现在买合算呀，一个手机可以用几年。"
5,手机外观外形精美大气上档次，屏幕音效不错，拍好效果更好，运行速度很流畅，手感很丝滑，拿在手里沉甸甸的
5,"外形外观：简约大方，颜色新颖～
屏幕音效：个人感觉整体很🉑
拍照效果：比较满意吖～清晰度很好
运行速度：适中（使用因人而异）
其他特色：京东自营正品保障，配送很快，店内服务态度很好，整体五星好评⭐⭐⭐⭐⭐😊😊会继续回购其他产品哒"
5,这款手机真的超级棒！拍照效果超一流📸，而且性能也非常不错，日常使用非常流畅👍。外观也很漂亮，拿着很有质感，强烈推荐！
5,"外形外观：一如既往的高颜值，简约大气，苹果风格。
屏幕音效：苹果的屏幕跟音效那肯定是没得说。一直在第一梯队。
运行速度：新处理器果然是最强。很丝滑。
待机时间：待机时间有待使用才知道。"
5,"特别好用的一款新手机，把自己用的12换成了新的了，京东的价格实在
是太给力了，
而且发货速度特别快。比一般的网购快多子，常且送货通度
也快，直接快递小哥给送到家里来了，太方便了。而且手机也是全新未激
活的状态。超级无敌给力。"
5,iPhone16promax的性能简直惊艳，操作流畅得让人难以置信。拍照功能强大到可以媲美专业相机，电池续航更是持久，彻底解放了我的电量焦虑。设计优雅，屏幕显示细腻生动，是我用过的手机中表现最出色的。非常满意这次购买，推荐给追求品质生活的你。
5,这款手机真是太棒了！📱✨ 屏幕清晰，运行流畅，拍照效果也很出色。特别是性能表现非常令人满意，特别适合日常使用和游戏体验。总体来说，性价比很高，强烈推荐购买！
5,第一次买苹果，以前一直都想拥有一台安卓和一台苹果，现在实现了，16promax这个系列我一直都挺喜欢的，我买的白色，外观不错，使用体验过暂时还好，各种新颖功能还需要我慢慢的摸索，有些东西真的是用过才知道好不好，拍照也很好看，特别是16这个系列的拍照，体验过很好！这个价位现在还能接受，真的挺不错了，目前体验很好，希望不会出现什么意外
5,这次在京东的购物体验非常满意！首先快递速度超快，隔天就收到货了，包装严实完好无损。商品质量完全超出预期，做工精细功能齐全，和页面描述的一模一样。客服态度也很专业，回复及时耐心解答问题。赶上促销活动价格特别划算，性价比真的很高！使用体验非常顺手，细节设计很人性化，完全满足日常需求。京东的售后服务也让人放心，有完善的质保承诺。整体购物过程零瑕疵，真正感受到大平台的品质保障，以后会继续回购，也会推荐给亲朋好友！五星好评必须安排上！
5,"外形外观：原色钛的好看，非常喜欢这颜色
运行速度：比旧机器快了不少，屏幕刷新率高起来也挺舒服
待机时间：电池很耐用"
5,"女朋友很喜欢拍照很好看，
以旧换新：很好
外形外观：可以
屏幕音效：强
拍照效果：强
喜欢推荐购买的朋友可以，推荐推荐
运行速度：快
待机时间：长，推荐大家购买，"
5,"入手苹果16 pro max使用后，体验感简直拉
满！外观设计简洁大方，拿在手上质感超棒。搭
载的A18 Pro芯片，运行速度超快，各种大型游
戏都能轻松驾驭，毫无卡顿。6.9英寸超视网膜
XDR屏，显示效果超清晰，色彩也很鲜艳。相机
升级后，拍照更出色，照片细节满满。续航能力
也很给力，完全不用担心电量问题，强烈推荐！"
5,外观大气，很有档次感！颜值一如既往地高。拍照照片很清晰，听音乐玩游戏音质很不错。运行速度快，不卡顿。待机时间也很长。
5,这款手机不仅颜值在线，性能更是强大到飞起！拍照效果非常出色，像素高清，色彩还原度非常高。📸🍎使用起来超级顺手，真是爱不释手啊！
5,苹果16是一款性能卓越的智能手机。在使用过程中，我发现其处理器强大，运行流畅，无论是日常使用还是大型游戏都能轻松应对。同时，其摄像头质量也非常出色，拍摄出的照片清晰度高，色彩鲜艳。此外，苹果16的电池续航能力也相当出色。总的来说，苹果16是一款值得推荐的智能手机。
5,"外形外观：非常喜欢这个颜色
屏幕音效：非常好的混响双响
拍照效果：非常清晰
运行速度：可以的，之前用12pro增添了游戏模式"
5,"外形外观：非常漂亮
其他特色：特别喜欢苹果手机外观系统，用起来特别流畅，
运行速度：很快
拍照效果：特别清晰，拍视频也很高清视觉效果很不错"
5,续航能力和我之前的14PM没有太大提升，但 是拍照摄像表现优秀，尤其在环球室内昏暗灯 光下。整体来说比较满意。屏幕G9P，觉得还 是很通透的。以后还会购买的很好用
5,这款手机真的太棒了！📱画面超清晰，拍照效果一流，尤其是夜景模式和广角镜头，简直是摄影爱好者的福音。性能也很强大，操作特别流畅，绝对值得入手。✨
5,这款手机是前一次自己购买后，使用的非常喜欢且又实惠，再次购买送给家人的。手机屏幕非常丝滑，显示效果佳，内存256足够用，拍照清晰真实，来电有语音信箱。很适合送长辈！
5,续航很好运行畅快 拍照清晰 续航很好拍照清晰运行畅快手机是全新的，第一批就抢到了，发货速度特别快，当天就到了，手机外观特别的时尚充电也很耐用，待机时间特别长拍照特别清晰，运用起来也不卡顿，手机屏幕大
5,用了快十年的苹果，目前手上在用的还是12pm，换了原装的电池和新的一样流畅，还是非常 想换新手机，到手之前还在纠结买三星还是苹果，到手之后觉得自己的考虑都很多余，没有可比性，必须苹果，真没让我失望，对比12pm提升蛮大的，使用的整体感受提升了很多，非常不错。
5,苹果16 Pro Max堪称年度机皇！超视网膜XDR屏细腻到窒息，ProMotion自适应刷新率丝滑流畅。A18仿生芯片性能炸裂，多任务处理毫无压力。全新4800万像素主摄支持8K电影模式，暗光拍摄宛如夜视仪。钛金属边框轻盈耐用，续航突破性提升，重度使用撑足一整天。智能岛交互更人性化，5G信号稳如磐石。从精致做工到革命性创新，每一处细节都彰显苹果极致追求，果粉闭眼入的顶级旗舰！
5,机身采用航空级铝合金/不锈钢中框+超瓷晶面板，质感高级且抗摔耐磨。钛金属材质手感轻盈却坚固，直角边框设计兼顾握持舒适度，细节打磨堪称艺术品。
5,"外形外观：非常好 特别新 竟然是25年4月产的 特别惊喜
拍照效果：跟13比真是划时代的提升
运行速度：高刷的感觉特别好 特别流畅"
5,🎈终于入手了新手机！就是包装多少有点损坏，没办法毕竟为了环保。外观时尚大气。拍照功能超赞，画质清晰细腻。性能强劲，操作流畅顺滑。真心推荐给大家，用起来真的超级满意！👍
5,"苹果🍎手机功能这些没什么可说的了，官网自营的，东西拿到手没什么问题，以旧换新还有补贴，不错不错。
旧手机回款是直接打卡里的，补贴款也是。
物流很快，很方便。值👍🏻"
5,以旧换新：体验感很好。这款手机使用感非常好，价格很划算，外形流畅，容量很大，外观颜色很好看，物流体验感很好，送达比较快。京东以旧换新和国补双补贴价格划算，个人很满意，已经推荐给别人五星好评
5,"外形外观：太好看了吧 白色的 超百搭手机壳
拍照效果：拍照也好好看看 像素特别清  还能自己随时调节滤镜
以旧换新：是以旧换新买的   旧手机也有国补 价格合适"
5,"期待很久了，降价了立马下手，日常使用非常丝滑
外形外观：依旧是苹果的质感
屏幕音效：新增的相机按键很适合我，可以随时进行抓拍"
5,"以旧换新：国家政策非常好，享受国家政策
外形外观：大气有内涵
屏幕音效：杠杠的，新手机就是快
拍照效果：效果可以，她很喜欢
运行速度：目前速度很快"
5,到手一个星期了！很好用，电池也很耐用，冲满电用一整天完全没压力。相机很好很清晰，系统很丝滑。后续再来评价😜
5,Iphone16promax心中的手机，终于在618前完成入手。作为苹果10年老用户，新品真的非常丝滑，外观高端大气上档次，材质手感非常好，屏幕清晰。拍照效果杠杠的。选择京东自营，没毛病
5,从安卓转苹果，这次真的没选错！生态联动（Apple Vision Pro无缝投屏！）、系统流畅度、隐私保护全是加分项。虽然价格不菲，但用下来觉得每一分钱都花在刀刃上。果粉可闭眼冲，犹豫的朋友建议去线下摸真机，质感会说话！
5,苹果最新款手机就是好用！系统非常流畅，质量很好。京东购物，方便快捷，服务十分周到。感谢这么好的平台和这么好的优惠！手机上手非常不错，手感丝滑，快递也很给力，服务也好！官方正品，是一次十分满意的购物体验！
5,很好用，京东自营的放心哦，跑的挺快的，苹果用了很久了，没有什么问题，处理器也很快。很好很好，好看的手机。正好现在用的13坏掉了，赶紧再买一台用上
5,用苹果手机用习惯了，新款真的很好用，操作起来依然这么丝滑流畅，感谢京东感谢国家补贴优惠，让我用上了16pm，现在拍照人像好看极了，相机都不用了。
5,白色很好看，干净，清爽，年轻人很合适，系统运行速度快。流畅，正在继续关注618活动，合适再买一台给家人
5,大品牌值得信赖，续航时间长，颜值高，拍照效果很好，握持的手感很好，生态系统很好，应用也很多，可玩性高，一直用苹果的手机，很省心，很满意的一次购物体验，值得推荐给大家。
5,"外形外观：外观大气
屏幕音效：外放完美
拍照效果：拍照还可以
运行速度：速度飞快
待机时间：续航强无敌
其他特色：系统流畅性不多解释，价格便宜值得购买"
5,质量很好，材质结实，拍照清晰，声音清晰，运行速度很快，用起来不卡，待机时间长，电池不错，物流很快，服务态度很好，玩游戏不卡，值得推荐！
5,非常好，第一次买这么贵的手机，1T的手机，直接到顶了，可以不用担心手机存储空间了，新机真的很漂亮，去实体店里看了，还是黑色最漂亮
5,日常使用流畅到飞起，玩大型游戏也毫无压力。6.9英寸超视网膜屏色彩细腻，观影体验绝了。新增的钛金属边框质感拉满，耐磨又高级。续航更是没得说。
5,iPhone 16 Pro Max 256G太强了！A18芯片流畅到飞起，6.9英寸超视网膜XDR屏色彩惊艳，续航直接撑两天。钛金属机身高级又轻便，5倍光学变焦拍照堪比单反，iOS系统丝滑无广告。从下单到入手全程完美，果粉闭眼冲！🍎💯
5,"手机很不错，第一次用pro系列拍照确实很清晰，记录生活拍宝宝都绝对够用了。和旧的苹果手机导数据也很方便，不用担心之前的照片用不上
就是手机对于女生有点大有点沉，还需要适应一下"
5,Apple 16 Pro Max真是让人眼前一亮！📱✨白色的机身配上强大的性能，简直完美无瑕。无论是玩游戏还是办公，都能轻松应对。包装里还附赠了充电线和保护壳，诚意满满！入手不亏，强烈推荐！
5,"外形外观：非常经典的苹果设计，简约时尚大气，
屏幕音效：一流水准没得挑，
拍照效果：遥遥领先堪比单反
运行速度：苹果的运行速度应该是所有手机的霸主地位了"
5,这个手机非常好，全新未拆封!像素很好，手机尺寸够大，比我以前的手机好多了。沙漠金色也很有特色，我很喜欢!手机看起来挺高档的!
5,"以旧换新：根据很划算，比想象中价格合理。
外形外观：外观还是依旧漂亮，比原来 14promax 好看，也好使
屏幕音效：屏幕比原先的要大
拍照效果：拍照效果毋庸置疑
同等价位的王者"
5,太喜欢了 ，白色的机器配什么壳子也好看，6.9寸追剧神器，性能强，显示也清晰，活动价入手，包装严实物流快，好棒👍
